{
  "schemaVersion": "rigor.attempt-session.v1",
  "artifactId": "attempt-session_e313b102-8926-446a-a92c-484993f52dd6",
  "taskId": "GH-16-R2",
  "createdAt": "2026-07-12T14:56:22.617Z",
  "sequence": 1,
  "routingPlanArtifactId": "routing-plan_7b5e5866-3309-4094-a010-97da23e7861f",
  "routingPlanHash": "a4d74217dd22223cc4070ff7b9a74ce0ae892d2b7383947ec3f4c62be89fde1f",
  "contractArtifactId": "contract_1e803230-ffd3-48da-a7b5-146f1e8ea3f1",
  "contractHash": "2eeb7888efe81dfba47afb5881da808512cd888f20edd06aa469aea7656c7d90",
  "purpose": "implementation",
  "budget": {
    "maxAttempts": 2,
    "maxDurationMs": 7200000,
    "maxRelativeCost": 20
  },
  "executionIdentityStatus": "unverified",
  "beforeHead": "8b349ce4cec1e1dcd6ea6ec51adabfcf866c8fff",
  "beforeTreeHash": "d6306921758100640dd61854b4c2713564a9e02ffe402d0eb4cd6685a3e8a042",
  "changedPathsBefore": [
    "README.md",
    "dist/rigor.cjs",
    "docs/architecture.md",
    "docs/evaluation.md",
    "docs/mvp-limitations.md",
    "docs/orchestration.md",
    "docs/product.md",
    "schemas/artifacts.v1.schema.json",
    "schemas/calibration-proposal.v1.schema.json",
    "schemas/evaluation-manifest.v1.schema.json",
    "schemas/evaluation-report.v1.schema.json",
    "src/cli.ts",
    "src/evaluation.ts",
    "src/types.ts",
    "test/e2e.test.ts",
    "test/evaluation.test.ts",
    "test/fixtures/evaluation/evidence/EVAL-BUG-1/attempts/attempt_EVAL-BUG-1_1.json",
    "test/fixtures/evaluation/evidence/EVAL-BUG-1/outcome.json",
    "test/fixtures/evaluation/evidence/EVAL-BUG-1/routing/routing-plan_EVAL-BUG-1_1.json",
    "test/fixtures/evaluation/evidence/EVAL-BUG-2/attempts/attempt_EVAL-BUG-2_1.json",
    "test/fixtures/evaluation/evidence/EVAL-BUG-2/outcome.json",
    "test/fixtures/evaluation/evidence/EVAL-BUG-2/routing/routing-plan_EVAL-BUG-2_1.json",
    "test/fixtures/evaluation/evidence/EVAL-BUG-3/attempts/attempt_EVAL-BUG-3_1.json",
    "test/fixtures/evaluation/evidence/EVAL-BUG-3/outcome.json",
    "test/fixtures/evaluation/evidence/EVAL-BUG-3/routing/routing-plan_EVAL-BUG-3_1.json",
    "test/fixtures/evaluation/evidence/EVAL-DOC-2/attempts/attempt_EVAL-DOC-2_1.json",
    "test/fixtures/evaluation/evidence/EVAL-DOC-2/outcome.json",
    "test/fixtures/evaluation/evidence/EVAL-DOC-2/routing/routing-plan_EVAL-DOC-2_1.json",
    "test/fixtures/evaluation/evidence/EVAL-FEAT-1/attempts/attempt_EVAL-FEAT-1_1.json",
    "test/fixtures/evaluation/evidence/EVAL-FEAT-1/attempts/attempt_EVAL-FEAT-1_2.json",
    "test/fixtures/evaluation/evidence/EVAL-FEAT-1/outcome.json",
    "test/fixtures/evaluation/evidence/EVAL-FEAT-1/routing/routing-plan_EVAL-FEAT-1_1.json",
    "test/fixtures/evaluation/evidence/EVAL-FEAT-1/routing/routing-plan_EVAL-FEAT-1_2.json",
    "test/fixtures/evaluation/evidence/EVAL-FEAT-2/attempts/attempt_EVAL-FEAT-2_1.json",
    "test/fixtures/evaluation/evidence/EVAL-FEAT-2/outcome.json",
    "test/fixtures/evaluation/evidence/EVAL-FEAT-2/routing/routing-plan_EVAL-FEAT-2_1.json",
    "test/fixtures/evaluation/evidence/EVAL-HOLD-1/attempts/attempt_EVAL-HOLD-1_1.json",
    "test/fixtures/evaluation/evidence/EVAL-HOLD-1/outcome.json",
    "test/fixtures/evaluation/evidence/EVAL-HOLD-1/routing/routing-plan_EVAL-HOLD-1_1.json",
    "test/fixtures/evaluation/evidence/EVAL-HOLD-2/attempts/attempt_EVAL-HOLD-2_1.json",
    "test/fixtures/evaluation/evidence/EVAL-HOLD-2/outcome.json",
    "test/fixtures/evaluation/evidence/EVAL-HOLD-2/routing/routing-plan_EVAL-HOLD-2_1.json",
    "test/fixtures/evaluation/evidence/EVAL-MALF-1/attempts/attempt_EVAL-MALF-1_1.json",
    "test/fixtures/evaluation/evidence/EVAL-MALF-1/outcome.json",
    "test/fixtures/evaluation/evidence/EVAL-MALF-1/routing/routing-plan_EVAL-MALF-1_1.json",
    "test/fixtures/evaluation/evidence/EVAL-REF-1/attempts/attempt_EVAL-REF-1_1.json",
    "test/fixtures/evaluation/evidence/EVAL-REF-1/outcome.json",
    "test/fixtures/evaluation/evidence/EVAL-REF-1/routing/routing-plan_EVAL-REF-1_1.json",
    "test/fixtures/evaluation/evidence/EVAL-REF-2/attempts/attempt_EVAL-REF-2_1.json",
    "test/fixtures/evaluation/evidence/EVAL-REF-2/attempts/attempt_EVAL-REF-2_2.json",
    "test/fixtures/evaluation/evidence/EVAL-REF-2/outcome.json",
    "test/fixtures/evaluation/evidence/EVAL-REF-2/routing/routing-plan_EVAL-REF-2_1.json",
    "test/fixtures/evaluation/evidence/EVAL-REF-2/routing/routing-plan_EVAL-REF-2_2.json",
    "test/fixtures/evaluation/expected-replay.json",
    "test/fixtures/evaluation/expected-report.json",
    "test/fixtures/evaluation/manifest.json",
    "test/fixtures/evaluation/proposal-input.json",
    "test/fixtures/evaluation/proposed-model-profiles.json",
    "test/fixtures/evaluation/worktrees/EVAL-HOLD-1/README.md",
    "test/schema.test.ts"
  ],
  "selection": {
    "provider": "claude",
    "model": "claude-opus-4-8",
    "capabilityClass": "premium"
  }
}
