{
  "schemaVersion": "rigor.attempt-session.v1",
  "artifactId": "attempt-session_d77ba2de-92d4-48b2-b37e-59783c6ee2ce",
  "taskId": "GH-25",
  "createdAt": "2026-07-12T21:34:01.981Z",
  "sequence": 2,
  "routingPlanArtifactId": "routing-plan_d73eb63a-2565-4ac3-a3ff-4c34089db289",
  "routingPlanHash": "5fb458f5a0ae4ecf96988479aa75ef8cc6cd5b4714f21e70b655ed0397ded12e",
  "contractArtifactId": "contract_0a12c06a-3980-4368-b76a-bf02067ff3c1",
  "contractHash": "a58e650aeb962f042c5426e76b4ad98eb0e28d1a6dc31c7b38dbe8d5f1d6d382",
  "purpose": "implementation",
  "budget": {
    "maxAttempts": 3,
    "maxDurationMs": 3600000,
    "maxRelativeCost": 100
  },
  "executionIdentityStatus": "unverified",
  "beforeHead": "e82f6f4136e0f478a46ad514cd63d690c9d70bd4",
  "beforeTreeHash": "2cf7d30d28432765aecba362469b677c5444514db53ecefcefaebda76a6ef984",
  "changedPathsBefore": [
    ".github/workflows/provenance-smoke.yml",
    ".github/workflows/release.yml",
    "CHANGELOG.md",
    "README.ja.md",
    "README.md",
    "docs/mvp-limitations.md",
    "docs/provenance.md",
    "docs/release.md",
    "docs/threat-model.md",
    "schemas/release-manifest.v1.schema.json",
    "scripts/package-plugin.mjs",
    "scripts/verify-provenance.mjs",
    "test/fixtures/provenance/README.md",
    "test/fixtures/provenance/empty.json",
    "test/fixtures/provenance/positive.json",
    "test/provenance.test.ts"
  ],
  "selection": {
    "provider": "claude",
    "model": "claude-opus-4-8",
    "capabilityClass": "premium"
  }
}
