{
  "schemaVersion": "rigor.attempt-session.v1",
  "artifactId": "attempt-session_a5a5dc06-2b1b-4fbd-82f5-dc13a771b4d5",
  "taskId": "GH-26",
  "createdAt": "2026-07-13T01:36:49.370Z",
  "sequence": 2,
  "routingPlanArtifactId": "routing-plan_926096ae-3bb3-41cf-9612-08f728bb4b4b",
  "routingPlanHash": "847227a3762aad5abcccd65dadbf43ec7424517ccdaff872d96fc3b8098a5dc4",
  "contractArtifactId": "contract_d0e8d907-0afb-463a-b370-22408f2be345",
  "contractHash": "6b4195675b6a9ed2c45dbafac4b78484d7dc6754cf8ef7ffa4f95edc68d8e884",
  "purpose": "implementation",
  "budget": {
    "maxAttempts": 3,
    "maxDurationMs": 3600000,
    "maxRelativeCost": 100
  },
  "executionIdentityStatus": "unverified",
  "beforeHead": "e159a4baf82d19193ca6d473a5fc5edd92282796",
  "beforeTreeHash": "b6676b528184c21ae5ac60e792a8952d5916c5d03aad419b7051c31023322153",
  "changedPathsBefore": [
    "CHANGELOG.md",
    "README.ja.md",
    "README.md",
    "docs/adr/0001-provenance-trust-model.md",
    "docs/mvp-limitations.md",
    "docs/provenance.md",
    "docs/release.md",
    "docs/threat-model.md",
    "scripts/install-verified.mjs",
    "scripts/verify-provenance.mjs",
    "test/fixtures/provenance/README.md",
    "test/fixtures/provenance/positive-real-v0.13.0.json",
    "test/provenance.test.ts"
  ],
  "selection": {
    "provider": "claude",
    "model": "claude-sonnet-5",
    "capabilityClass": "premium"
  }
}
