{
  "schemaVersion": "rigor.attempt-session.v1",
  "artifactId": "attempt-session_1e3ce751-0282-48aa-b36a-3ba815d89e76",
  "taskId": "GH-10",
  "createdAt": "2026-07-11T14:39:29.371Z",
  "sequence": 2,
  "routingPlanArtifactId": "routing-plan_585fc5fb-abed-43b1-acfd-2a97c73a6414",
  "routingPlanHash": "1a0c5995307d06ba65f6e18150af7d9ac6294a2ac297eed8c8376b996efd513d",
  "contractArtifactId": "contract_fcb6a679-37ec-4752-90cc-306ef08be6e4",
  "contractHash": "fad1be357205f0b97d615c9eddac91c3d8ebf05ef69d74f46ea628c2b19c8c66",
  "purpose": "implementation",
  "budget": {
    "maxAttempts": 3,
    "maxDurationMs": 3600000,
    "maxRelativeCost": 100
  },
  "executionIdentityStatus": "unverified",
  "beforeHead": "a0f5fc5b66f4d915b421b3c2e080d6c1ff58aab4",
  "beforeTreeHash": "c5c5e2bd09a995f1b1f7e35a202858cb013f0b1621144b9a42acd57b20b6f7fe",
  "changedPathsBefore": [
    "docs/orchestration.md",
    "schemas/routing-decision.v1.schema.json",
    "schemas/routing-input.v2.schema.json",
    "schemas/routing-plan.v1.schema.json",
    "src/routing.ts",
    "src/types.ts",
    "test/routing.test.ts"
  ],
  "selection": {
    "provider": "claude",
    "model": "claude-sonnet-5",
    "capabilityClass": "standard"
  }
}
